[
  {
    "legacy_id": "1",
    "kind": "auction",
    "source_file": "config/auctionhouse.json",
    "source_layer": "stored",
    "content_version": "3cdcea148de403603bda0781e66ff00ab4bb56bbd66dcf1373c305123f180c2e",
    "uuid": "1",
    "unit": 1167,
    "unit_ref": "1167",
    "unit_name": "Blue Steel Bahamut",
    "unit_resolved": true,
    "level": 1,
    "interval": 120,
    "interval_unit": "minutes",
    "price": 5000,
    "priceIncrement": 1000,
    "betPrice": 2,
    "bet_price_consumed": false
  },
  {
    "legacy_id": "2",
    "kind": "auction",
    "source_file": "config/auctionhouse.json",
    "source_layer": "stored",
    "content_version": "3cdcea148de403603bda0781e66ff00ab4bb56bbd66dcf1373c305123f180c2e",
    "uuid": "2",
    "unit": 1168,
    "unit_ref": "1168",
    "unit_name": "Blue Steel Draggy",
    "unit_resolved": true,
    "level": 1,
    "interval": 60,
    "interval_unit": "minutes",
    "price": 1000,
    "priceIncrement": 200,
    "betPrice": 2,
    "bet_price_consumed": false
  },
  {
    "legacy_id": "3",
    "kind": "auction",
    "source_file": "config/auctionhouse.json",
    "source_layer": "stored",
    "content_version": "3cdcea148de403603bda0781e66ff00ab4bb56bbd66dcf1373c305123f180c2e",
    "uuid": "3",
    "unit": 1226,
    "unit_ref": "1226",
    "unit_name": "Red Mercury Dragon",
    "unit_resolved": true,
    "level": 2,
    "interval": 120,
    "interval_unit": "minutes",
    "price": 8000,
    "priceIncrement": 1500,
    "betPrice": 2,
    "bet_price_consumed": false
  }
]
